{
  "$schema": "https://json-schema.org/draft/2020-12/schema",
  "$id": "https://github.com/Valeron2206/autosk-traycer-flow/resources/planning-publication/candidate-keepalive-operation.schema.json",
  "title": "autosk-flow candidate keepalive operation",
  "type": "object",
  "additionalProperties": false,
  "required": [
    "schema",
    "operation_id",
    "project_root_sha256",
    "epic_id",
    "epic_ref_key",
    "candidate_identity",
    "candidate_identity_preimage",
    "ref",
    "audit_ref",
    "object_format",
    "snapshot_commit_oid",
    "snapshot_tree_oid",
    "snapshot_commit_recipe",
    "snapshot_object_receipt",
    "expected_update_message",
    "reflog_producer",
    "ref_custody_generation",
    "ref_custody_policy_digest",
    "phase",
    "terminal_disposition",
    "create_receipt",
    "release_receipt",
    "audit_receipt",
    "created_at_utc"
  ],
  "properties": {
    "schema": { "const": 1 },
    "operation_id": { "$ref": "#/$defs/uuid" },
    "project_root_sha256": { "$ref": "#/$defs/sha256" },
    "epic_id": { "$ref": "#/$defs/uuid" },
    "epic_ref_key": { "$ref": "#/$defs/sha256" },
    "candidate_identity": { "$ref": "#/$defs/sha256" },
    "candidate_identity_preimage": { "$ref": "#/$defs/candidate_identity_preimage" },
    "ref": { "type": "string", "pattern": "^refs/autosk/epics/[0-9a-f]{64}/candidates/[0-9a-f]{64}$" },
    "audit_ref": { "type": "string", "pattern": "^refs/autosk/epics/[0-9a-f]{64}/audit/candidates/[0-9a-f]{64}$" },
    "object_format": { "enum": ["sha1", "sha256"] },
    "snapshot_commit_oid": { "$ref": "#/$defs/oid" },
    "snapshot_tree_oid": { "$ref": "#/$defs/oid" },
    "snapshot_commit_recipe": { "$ref": "#/$defs/snapshot_commit_recipe" },
    "snapshot_object_receipt": { "oneOf": [{ "type": "null" }, { "$ref": "#/$defs/snapshot_object_receipt" }] },
    "expected_update_message": { "type": "string", "pattern": "^autosk-flow keepalive [0-9a-f]{8}-[0-9a-f]{4}-4[0-9a-f]{3}-[89ab][0-9a-f]{3}-[0-9a-f]{12}$" },
    "reflog_producer": { "$ref": "#/$defs/reflog_producer" },
    "ref_custody_generation": { "type": "integer", "minimum": 1 },
    "ref_custody_policy_digest": { "$ref": "#/$defs/sha256" },
    "phase": { "enum": ["prepared", "object_written", "ref_created", "verified", "audit_retained", "released"] },
    "terminal_disposition": { "enum": ["audit_retained", "published_released", null] },
    "create_receipt": { "oneOf": [{ "type": "null" }, { "$ref": "#/$defs/create_receipt" }] },
    "release_receipt": { "oneOf": [{ "type": "null" }, { "$ref": "#/$defs/release_receipt" }] },
    "audit_receipt": { "oneOf": [{ "type": "null" }, { "$ref": "#/$defs/audit_receipt" }] },
    "created_at_utc": { "type": "string", "format": "date-time", "pattern": "^\\d{4}-\\d{2}-\\d{2}T\\d{2}:\\d{2}:\\d{2}Z$" }
  },
  "allOf": [
    {
      "if": { "properties": { "phase": { "const": "prepared" } } },
      "then": {
        "properties": {
          "terminal_disposition": { "type": "null" },
          "snapshot_object_receipt": { "type": "null" },
          "create_receipt": { "type": "null" },
          "release_receipt": { "type": "null" },
          "audit_receipt": { "type": "null" }
        }
      }
    },
    {
      "if": { "properties": { "phase": { "const": "object_written" } } },
      "then": {
        "properties": {
          "terminal_disposition": { "type": "null" },
          "snapshot_object_receipt": { "$ref": "#/$defs/snapshot_object_receipt" },
          "create_receipt": { "type": "null" },
          "release_receipt": { "type": "null" },
          "audit_receipt": { "type": "null" }
        }
      }
    },
    {
      "if": { "properties": { "phase": { "enum": ["ref_created", "verified"] } } },
      "then": {
        "properties": {
          "terminal_disposition": { "type": "null" },
          "snapshot_object_receipt": { "$ref": "#/$defs/snapshot_object_receipt" },
          "create_receipt": { "$ref": "#/$defs/create_receipt" },
          "release_receipt": { "type": "null" },
          "audit_receipt": { "type": "null" }
        }
      }
    },
    {
      "if": { "properties": { "phase": { "const": "audit_retained" } } },
      "then": {
        "properties": {
          "terminal_disposition": { "const": "audit_retained" },
          "snapshot_object_receipt": { "$ref": "#/$defs/snapshot_object_receipt" },
          "create_receipt": { "$ref": "#/$defs/create_receipt" },
          "release_receipt": { "type": "null" },
          "audit_receipt": { "$ref": "#/$defs/audit_retained_receipt" }
        }
      }
    },
    {
      "if": { "properties": { "phase": { "const": "released" } } },
      "then": {
        "properties": {
          "terminal_disposition": { "const": "published_released" },
          "snapshot_object_receipt": { "$ref": "#/$defs/snapshot_object_receipt" },
          "create_receipt": { "$ref": "#/$defs/create_receipt" },
          "release_receipt": { "$ref": "#/$defs/release_receipt" },
          "audit_receipt": { "$ref": "#/$defs/audit_receipt" }
        }
      }
    }
  ],
  "$defs": {
    "uuid": { "type": "string", "pattern": "^[0-9a-f]{8}-[0-9a-f]{4}-4[0-9a-f]{3}-[89ab][0-9a-f]{3}-[0-9a-f]{12}$" },
    "sha256": { "type": "string", "pattern": "^[0-9a-f]{64}$" },
    "oid": { "type": "string", "pattern": "^(?:[0-9a-f]{40}|[0-9a-f]{64})$" },
    "candidate_identity_preimage": {
      "type": "object", "additionalProperties": false,
      "required": ["anchor_version", "candidate_tree_oid", "epic_id", "kind", "pathspec_or_projection_digest", "project_root_sha256", "snapshot_commit_oid"],
      "properties": { "anchor_version": { "type": "integer", "minimum": 0 }, "candidate_tree_oid": { "$ref": "#/$defs/oid" }, "epic_id": { "$ref": "#/$defs/uuid" }, "kind": { "enum": ["artifact_pass", "anchor_invalidation"] }, "pathspec_or_projection_digest": { "$ref": "#/$defs/sha256" }, "project_root_sha256": { "$ref": "#/$defs/sha256" }, "snapshot_commit_oid": { "$ref": "#/$defs/oid" } }
    },
    "actor": {
      "type": "object",
      "additionalProperties": false,
      "required": ["name_utf8", "email_ascii", "timestamp_seconds", "timezone"],
      "properties": {
        "name_utf8": { "type": "string", "minLength": 1, "pattern": "^[^\\r\\n<>]+$" },
        "email_ascii": { "type": "string", "pattern": "^[A-Za-z0-9.!#$%&'*+/=?^_`{|}~-]+@[A-Za-z0-9.-]+$" },
        "timestamp_seconds": { "type": "integer" },
        "timezone": { "const": "+0000" }
      }
    },
    "snapshot_signing": {
      "type": "object",
      "additionalProperties": false,
      "required": ["mode", "policy_digest", "signature_header_base64"],
      "properties": {
        "mode": { "const": "none" },
        "policy_digest": { "$ref": "#/$defs/sha256" },
        "signature_header_base64": { "type": "null" }
      }
    },
    "snapshot_commit_recipe": {
      "type": "object",
      "additionalProperties": false,
      "required": ["schema", "object_format", "tree_oid", "parent_oids", "author", "committer", "message_utf8_base64", "signing", "commit_object_bytes_base64", "commit_object_bytes_sha256", "expected_commit_oid"],
      "properties": {
        "schema": { "const": 1 },
        "object_format": { "enum": ["sha1", "sha256"] },
        "tree_oid": { "$ref": "#/$defs/oid" },
        "parent_oids": { "type": "array", "minItems": 1, "maxItems": 1, "items": { "$ref": "#/$defs/oid" } },
        "author": { "$ref": "#/$defs/actor" },
        "committer": { "$ref": "#/$defs/actor" },
        "message_utf8_base64": { "type": "string", "pattern": "^[A-Za-z0-9+/]+={0,2}$" },
        "signing": { "$ref": "#/$defs/snapshot_signing" },
        "commit_object_bytes_base64": { "type": "string", "pattern": "^[A-Za-z0-9+/]+={0,2}$" },
        "commit_object_bytes_sha256": { "$ref": "#/$defs/sha256" },
        "expected_commit_oid": { "$ref": "#/$defs/oid" }
      }
    },
    "snapshot_object_receipt": {
      "type": "object",
      "additionalProperties": false,
      "required": ["schema", "operation_id", "object_format", "object_oid", "object_bytes_sha256", "tree_oid", "parent_oid", "receipt_hash"],
      "properties": {
        "schema": { "const": 1 },
        "operation_id": { "$ref": "#/$defs/uuid" },
        "object_format": { "enum": ["sha1", "sha256"] },
        "object_oid": { "$ref": "#/$defs/oid" },
        "object_bytes_sha256": { "$ref": "#/$defs/sha256" },
        "tree_oid": { "$ref": "#/$defs/oid" },
        "parent_oid": { "$ref": "#/$defs/oid" },
        "receipt_hash": { "$ref": "#/$defs/sha256" }
      }
    },
    "reflog_producer": {
      "type": "object",
      "additionalProperties": false,
      "required": ["git_committer_name", "git_committer_email", "git_committer_date", "lc_all", "tz", "git_config_system", "git_config_global", "git_config_nosystem", "hooks_path", "inherit_git_environment", "update_ref_mode"],
      "properties": {
        "git_committer_name": { "type": "string", "minLength": 1, "pattern": "^[^\\r\\n<>]+$" },
        "git_committer_email": { "type": "string", "pattern": "^[A-Za-z0-9.!#$%&'*+/=?^_`{|}~-]+@[A-Za-z0-9.-]+$" },
        "git_committer_date": { "type": "string", "pattern": "^@[0-9]+ \\+0000$" },
        "lc_all": { "const": "C" },
        "tz": { "const": "UTC" },
        "git_config_system": { "const": "/dev/null" },
        "git_config_global": { "const": "/dev/null" },
        "git_config_nosystem": { "const": "1" },
        "hooks_path": { "const": "/dev/null" },
        "inherit_git_environment": { "const": false },
        "update_ref_mode": { "const": "object_format_neutral_expected_old" }
      }
    },
    "create_receipt": {
      "type": "object",
      "additionalProperties": false,
      "required": ["schema", "operation_id", "candidate_identity", "ref", "observed_old_oid", "observed_new_oid", "snapshot_tree_oid", "expected_update_message", "before_entry_count", "after_entry_count", "before_prefix_sha256", "appended_entry_sha256", "observation_sha256", "helper_evidence", "receipt_hash"],
      "properties": {
        "schema": { "const": 1 },
        "operation_id": { "$ref": "#/$defs/uuid" },
        "candidate_identity": { "$ref": "#/$defs/sha256" },
        "ref": { "type": "string" },
        "observed_old_oid": { "type": "null" },
        "observed_new_oid": { "$ref": "#/$defs/oid" },
        "snapshot_tree_oid": { "$ref": "#/$defs/oid" },
        "expected_update_message": { "type": "string" },
        "before_entry_count": { "const": 0 },
        "after_entry_count": { "const": 1 },
        "before_prefix_sha256": { "$ref": "#/$defs/sha256" },
        "appended_entry_sha256": { "$ref": "#/$defs/sha256" },
        "observation_sha256": { "$ref": "#/$defs/sha256" },
        "helper_evidence": { "oneOf": [{ "type": "null" }, { "$ref": "#/$defs/helper_evidence" }] },
        "receipt_hash": { "$ref": "#/$defs/sha256" }
      }
    },
    "audit_receipt": {
      "type": "object",
      "additionalProperties": false,
      "required": ["schema", "operation_id", "candidate_identity", "live_ref", "audit_ref", "snapshot_commit_oid", "reason", "ref_custody_generation", "ref_custody_policy_digest", "observation_sha256", "helper_evidence", "receipt_hash"],
      "properties": {
        "schema": { "const": 1 },
        "operation_id": { "$ref": "#/$defs/uuid" },
        "candidate_identity": { "$ref": "#/$defs/sha256" },
        "live_ref": { "type": "string" },
        "audit_ref": { "type": "string" },
        "snapshot_commit_oid": { "$ref": "#/$defs/oid" },
        "reason": { "enum": ["panel_not_pass", "narrow_not_pass", "voided_before_ref", "publication_verified", "superseded"] },
        "ref_custody_generation": { "type": "integer", "minimum": 1 },
        "ref_custody_policy_digest": { "$ref": "#/$defs/sha256" },
        "observation_sha256": { "$ref": "#/$defs/sha256" },
        "helper_evidence": { "oneOf": [{ "type": "null" }, { "$ref": "#/$defs/helper_evidence" }] },
        "receipt_hash": { "$ref": "#/$defs/sha256" }
      }
    },
    "audit_retained_receipt": {
      "allOf": [
        { "$ref": "#/$defs/audit_receipt" },
        { "properties": { "reason": { "enum": ["panel_not_pass", "narrow_not_pass", "voided_before_ref", "superseded"] } } }
      ]
    },
    "release_receipt": {
      "type": "object",
      "additionalProperties": false,
      "required": ["schema", "operation_id", "candidate_identity", "ref", "expected_old_oid", "planning_ref", "verified_commit_oid", "planning_reflog_after_receipt_hash", "planning_reflog_tail_observation_sha256", "transaction_observation_sha256", "audit_candidate_ref", "audit_candidate_oid", "ref_custody_generation", "ref_custody_policy_digest", "closure_verified", "helper_evidence", "receipt_hash"],
      "properties": {
        "schema": { "const": 1 },
        "operation_id": { "$ref": "#/$defs/uuid" },
        "candidate_identity": { "$ref": "#/$defs/sha256" },
        "ref": { "type": "string", "pattern": "^refs/autosk/epics/[0-9a-f]{64}/candidates/[0-9a-f]{64}$" },
        "expected_old_oid": { "$ref": "#/$defs/oid" },
        "planning_ref": { "type": "string", "pattern": "^refs/autosk/epics/[0-9a-f]{64}/planning$" },
        "verified_commit_oid": { "$ref": "#/$defs/oid" },
        "planning_reflog_after_receipt_hash": { "$ref": "#/$defs/sha256" },
        "planning_reflog_tail_observation_sha256": { "$ref": "#/$defs/sha256" },
        "transaction_observation_sha256": { "$ref": "#/$defs/sha256" },
        "audit_candidate_ref": { "type": "string", "pattern": "^refs/autosk/epics/[0-9a-f]{64}/audit/candidates/[0-9a-f]{64}$" },
        "audit_candidate_oid": { "$ref": "#/$defs/oid" },
        "ref_custody_generation": { "type": "integer", "minimum": 1 },
        "ref_custody_policy_digest": { "$ref": "#/$defs/sha256" },
        "closure_verified": { "const": true },
        "helper_evidence": { "oneOf": [{ "type": "null" }, { "$ref": "#/$defs/helper_evidence" }] },
        "receipt_hash": { "$ref": "#/$defs/sha256" }
      }
    },
    "helper_evidence": {
      "type": "object", "additionalProperties": false,
      "required": ["request_id", "nonce", "transaction_value_observation_sha256", "helper_receipt_hash"],
      "properties": { "request_id": { "$ref": "#/$defs/uuid" }, "nonce": { "$ref": "#/$defs/sha256" }, "transaction_value_observation_sha256": { "$ref": "#/$defs/sha256" }, "helper_receipt_hash": { "$ref": "#/$defs/sha256" } }
    }
  }
}
