{
  "schema": 1,
  "project_root_sha256": "aaaaaaaaaaaaaaaaaaaaaaaaaaaaaaaaaaaaaaaaaaaaaaaaaaaaaaaaaaaaaaaa",
  "epic_id": "22222222-2222-4222-8222-222222222222",
  "epic_ref_key": "e8bf51e33ced6fd2373da93a8317cac9158ff524d31c8d972705b25c6b1873c1",
  "candidate_identity": "1347dcda3447bc0b10e6bb4eb85a2ee7b4c2d8deeea92a924fb0bf7637b80dc9",
  "ref": "refs/autosk/epics/e8bf51e33ced6fd2373da93a8317cac9158ff524d31c8d972705b25c6b1873c1/candidates/1347dcda3447bc0b10e6bb4eb85a2ee7b4c2d8deeea92a924fb0bf7637b80dc9",
  "audit_ref": "refs/autosk/epics/e8bf51e33ced6fd2373da93a8317cac9158ff524d31c8d972705b25c6b1873c1/audit/candidates/1347dcda3447bc0b10e6bb4eb85a2ee7b4c2d8deeea92a924fb0bf7637b80dc9",
  "object_format": "sha1",
  "snapshot_commit_oid": "264029a5827e5674dc038091abea2c6df347bd2b",
  "snapshot_tree_oid": "2222222222222222222222222222222222222222",
  "expected_update_message": "autosk-flow keepalive 77777777-7777-4777-8777-777777777777",
  "reflog_producer": {
    "git_committer_name": "autosk-flow",
    "git_committer_email": "autosk@example.invalid",
    "git_committer_date": "@0 +0000",
    "lc_all": "C",
    "tz": "UTC",
    "git_config_system": "/dev/null",
    "git_config_global": "/dev/null",
    "git_config_nosystem": "1",
    "hooks_path": "/dev/null",
    "inherit_git_environment": false,
    "update_ref_mode": "object_format_neutral_expected_old"
  },
  "phase": "verified",
  "create_receipt": {
    "schema": 1,
    "after_entry_count": 1,
    "appended_entry_sha256": "330ae724227aa55ac451bbc44e104059d946474f2a2339df0c10e1f8f3c1e38c",
    "before_entry_count": 0,
    "before_prefix_sha256": "fc2f7eeb37342d4d5eaf88fbc2ae6bf3b37e57ed4dcb73c9e81bc51c5780eb3b",
    "candidate_identity": "1347dcda3447bc0b10e6bb4eb85a2ee7b4c2d8deeea92a924fb0bf7637b80dc9",
    "expected_update_message": "autosk-flow keepalive 77777777-7777-4777-8777-777777777777",
    "observed_new_oid": "264029a5827e5674dc038091abea2c6df347bd2b",
    "observed_old_oid": null,
    "ref": "refs/autosk/epics/e8bf51e33ced6fd2373da93a8317cac9158ff524d31c8d972705b25c6b1873c1/candidates/1347dcda3447bc0b10e6bb4eb85a2ee7b4c2d8deeea92a924fb0bf7637b80dc9",
    "snapshot_tree_oid": "2222222222222222222222222222222222222222",
    "observation_sha256": "35db5200f9c5ac8af9974d1aec6448496f769f481ef522ca07150a5494152ad2",
    "receipt_hash": "4f278ae3291146d0a96c703a03773b94a26e6b5578fed82d1a4a6543bdc23583",
    "operation_id": "77777777-7777-4777-8777-777777777777",
    "helper_evidence": {
      "request_id": "00000002-1111-4111-8111-000000000002",
      "nonce": "5b6739b0eaa02628a36335a71ea50c59b154e3e084843f5b83d2c9e23501e27d",
      "transaction_value_observation_sha256": "3b531899e4e48edf13c26963374d7e378649af30edab7593f6a7aad426e84a77",
      "helper_receipt_hash": "2d788af26e83bf378b3a2e6bdb37f193585994e4f5fd03687b97b856e3672621"
    }
  },
  "release_receipt": null,
  "audit_receipt": null,
  "terminal_disposition": null,
  "created_at_utc": "2026-09-01T00:00:00Z",
  "ref_custody_policy_digest": "2222222222222222222222222222222222222222222222222222222222222222",
  "ref_custody_generation": 1,
  "operation_id": "77777777-7777-4777-8777-777777777777",
  "snapshot_commit_recipe": {
    "schema": 1,
    "object_format": "sha1",
    "tree_oid": "2222222222222222222222222222222222222222",
    "parent_oids": [
      "3333333333333333333333333333333333333333"
    ],
    "author": {
      "name_utf8": "autosk-flow",
      "email_ascii": "autosk@example.invalid",
      "timestamp_seconds": 0,
      "timezone": "+0000"
    },
    "committer": {
      "name_utf8": "autosk-flow",
      "email_ascii": "autosk@example.invalid",
      "timestamp_seconds": 0,
      "timezone": "+0000"
    },
    "message_utf8_base64": "YXV0b3NrLWZsb3cgcGxhbm5pbmcgY2FuZGlkYXRlCg==",
    "signing": {
      "mode": "none",
      "policy_digest": "5555555555555555555555555555555555555555555555555555555555555555",
      "signature_header_base64": null
    },
    "commit_object_bytes_base64": "dHJlZSAyMjIyMjIyMjIyMjIyMjIyMjIyMjIyMjIyMjIyMjIyMjIyMjIyMjIyCnBhcmVudCAzMzMzMzMzMzMzMzMzMzMzMzMzMzMzMzMzMzMzMzMzMzMzMzMzMzMzCmF1dGhvciBhdXRvc2stZmxvdyA8YXV0b3NrQGV4YW1wbGUuaW52YWxpZD4gMCArMDAwMApjb21taXR0ZXIgYXV0b3NrLWZsb3cgPGF1dG9za0BleGFtcGxlLmludmFsaWQ+IDAgKzAwMDAKCmF1dG9zay1mbG93IHBsYW5uaW5nIGNhbmRpZGF0ZQo=",
    "commit_object_bytes_sha256": "f98f6871a033cf372824ef4c7d0ec76c60bd969985913baad0654431e12010b1",
    "expected_commit_oid": "264029a5827e5674dc038091abea2c6df347bd2b"
  },
  "snapshot_object_receipt": {
    "schema": 1,
    "operation_id": "77777777-7777-4777-8777-777777777777",
    "object_format": "sha1",
    "object_oid": "264029a5827e5674dc038091abea2c6df347bd2b",
    "object_bytes_sha256": "f98f6871a033cf372824ef4c7d0ec76c60bd969985913baad0654431e12010b1",
    "tree_oid": "2222222222222222222222222222222222222222",
    "parent_oid": "3333333333333333333333333333333333333333",
    "receipt_hash": "29f452c46264c2ab6c0ec93df87cb3412d1dcb10de30085b9c0e828b109163ee"
  },
  "candidate_identity_preimage": {
    "anchor_version": 1,
    "candidate_tree_oid": "2222222222222222222222222222222222222222",
    "epic_id": "22222222-2222-4222-8222-222222222222",
    "kind": "artifact_pass",
    "pathspec_or_projection_digest": "4006919827ded05e5cde9e759db130cf8dce7c0b7be1ea29d91016b6f487e788",
    "project_root_sha256": "aaaaaaaaaaaaaaaaaaaaaaaaaaaaaaaaaaaaaaaaaaaaaaaaaaaaaaaaaaaaaaaa",
    "snapshot_commit_oid": "264029a5827e5674dc038091abea2c6df347bd2b"
  }
}
